"Listing Id","FSN","SKU","MRP","FSP","bangle_size","diameter","color","pack_of","model_number","brand"
"LSTBBAESYDJKGJEUCXYIPORBT","BBAESYDJKGJEUCXY","ASBr003022","1599.0","195.0","Free","free size inch","Silver","1","Curban Link 10mm Thickness ASBr003022","Shiv Jagdamba"
"LSTBBAGG46F28CHE7FGJ07KIC","BBAGG46F28CHE7FG","SBr2022360","999.0","176.0","Free","Free Size inch","Black","1","I Love You Heart Beat Lifeline Wristband SBr01","M Men Style"
"LSTBBAFUFMDHSNWCV6ZADJJX0","BBAFUFMDHSNWCV6Z","Stainlessbr5","799.0","173.0","Free","Free Size inch","Silver","1","Stainlessbr5","M Men Style"
"LSTBBAH7Z9TUTWFDARCYSFZTV","BBAH7Z9TUTWFDARC","Ska2024114","1299.0","715.0","Free","Free Size inch","Gold","1","AYATUL KURSI Islamic Jewelry Bangles Kada Arabic Calligraphy Gold Ska2024114","M Men Style"
"LSTBBAGA7X9P3GMHSGEJWJWSC","BBAGA7X9P3GMHSGE","SujalBr010","799.0","176.0","Free","Free Size inch","Multicolor","1","Allah Bracelet Wristand Band Anishbr10","M Men Style"
"LSTBBAGYJC894B47TC7C3KHQH","BBAGYJC894B47TC7","FlipSBrN28","799.0","198.0","Free","Free Size inch","Black","1","Religious Allah Prayer Muslim Islamic Silicone Bracelet FlipSBrN28","M Men Style"
"LSTBBAGYJC9TZGJSKBBMYKNT5","BBAGYJC9TZGJSKBB","FlipSBrN25","799.0","235.0","Free","Free Size inch","Black","1","Religious Allah Prayer Muhammad Rasulullah Silicone Bracelet FlipSBrN25","M Men Style"
"LSTBBAGEG5G6GEFQMYW4KVADT","BBAGEG5G6GEFQMYW","SBR202268","999.0","248.0","Free","Free Size inch","Black","1","Muslim Islam Allah Stainless Steel Silicone Bracelet SBr202268","M Men Style"
"LSTBBAGXHXXQHPBVKPJ0KWQKL","BBAGXHXXQHPBVKPJ","SBrN63","799.0","245.0","Free","Free Size inch","Silver","1","Islamic Calligraphy Muslim Name God Islam Allah Faith Silicone Bracelet SBrN63","M Men Style"
"LSTBBAGYJCYHNVVQBGHXID9FH","BBAGYJCYHNVVQBGH","FlipSBrN71","799.0","219.0","Free","Free Size inch","Silver","1","Religious Allah Prayer Muslim Islamic Silicone Bracelet FlipSBrN71","M Men Style"
"LSTBBAGG46FNYHTKTXNKNE16N","BBAGG46FNYHTKTXN","SBr2022363","999.0","192.0","Free","Free Size inch","Black","1","Mom And Dad Heart Beat Lifeline Wristband SBr15","M Men Style"
"LSTBBAGG8EHZAHCV9R8YTPLSA","BBAGG8EHZAHCV9R8","SBr2022378","799.0","180.0","Free","Free Size inch","Black","1","Religious Jay Mahakal Engraved Wristband SBr2022378","M Men Style"
"LSTBBAGG462TEWUHXRKCAWNVR","BBAGG462TEWUHXRK","SBr2022373","999.0","157.0","Free","Free Size inch","Black","1","Jesus Cross Heart Beat Lifeline Wristband SBr07","M Men Style"
"LSTBBAGGSGWTR2EESHA5BTOX5","BBAGGSGWTR2EESHA","SujalBr2022409","799.0","165.0","Free","Free Size inch","Silver","1","Religious Lord Shiv Om Namah Shivay Yoga Meditation Jewellery BraceletSBr2022402","M Men Style"
"LSTBBAGGSGW5PN9HGY5ICO0FA","BBAGGSGW5PN9HGY5","SujalBr2022410","799.0","200.0","Free","Free Size inch","Black","1","Om Aum Ohm Symbol Meaningful Charm Gift Idea Yoga Meditation JewellerySBr2022403","M Men Style"
"LSTBBAH2YPYMGHSVHEH7GB6T9","BBAH2YPYMGHSVHEH","New LSBr2201","799.0","226.0","Free","Free Size inch","Silver, Black","1","Religious Allah With Mohammed Islamic Bracelet New LSBr2201","M Men Style"
"LSTBBAGZUJEHATDTHYB6VZY1L","BBAGZUJEHATDTHYB","LSBr22012","799.0","178.0","Free","Free inch","Silver","1","Bikers Jewelry jay Bheem Silicone Stainless Steel BraceletLSBr22012","M Men Style"
"LSTBBAH45D9D5ZXSTRSAFXYLF","BBAH45D9D5ZXSTRS","Ska202423","799.0","233.0","Free","Free Size inch","Silver","1","Muslim Islam |Arabic Calligraphy | Engraved Ayatul Kursi | Kada Ska202423","M Men Style"
